{
  "schema_version": "1.0.0",
  "bundle_id": "symptom-checker.abdomen.v1",
  "bundle_version": "0.1.0-draft",
  "status": "draft",
  "locale": "fa-IR",
  "created": "2026-10-31",
  "scope": {
    "cluster": "درد شکم/پهلو در بزرگسالان",
    "first_path": "آپاندیسیت",
    "conditions_in_scope": ["app", "kidney_stone", "kidney_infection", "urinary_tract", "gastroenteritis"],
    "excluded_by_design": [
      "کودکان زیر ۱۸ سال به‌عنوان پوشش فعال (می‌تواند الگوی نشانه متفاوت داشته باشد)",
      "بارداری و احتمال بارداری (خارج از پوشش این بسته؛ ارجاع به ارزیابی فوری)",
      "وضعیت پس از جراحی شکم"
    ],
    "not_a_diagnosis": "این بسته موضوع‌های مرتبط را بر پایهٔ قواعد مستند پیشنهاد می‌کند؛ تشخیص، معاینه و آزمایش نیست و ادعای دقت بالینی ندارد."
  },
  "answer_states": ["yes", "no", "unknown", "not_asked", "not_in_profile"],
  "sources": [
    {
      "id": "src_profile_app",
      "kind": "internal_profile",
      "title_fa": "شناسنامهٔ آپاندیسیت در مخزن",
      "publisher": "همیار جراحی — دادهٔ قالب",
      "ref": "themes/lax-theme-child/data/disease-profiles.json#app",
      "url": "https://github.com/lakanzino/OR-site/blob/main/themes/lax-theme-child/data/disease-profiles.json",
      "accessed": "2026-10-31"
    },
    {
      "id": "src_profile_kidney_stone",
      "kind": "internal_profile",
      "title_fa": "شناسنامهٔ سنگ کلیه در مخزن",
      "publisher": "همیار جراحی — دادهٔ قالب",
      "ref": "themes/lax-theme-child/data/disease-profiles.json#kidney_stone",
      "url": "https://github.com/lakanzino/OR-site/blob/main/themes/lax-theme-child/data/disease-profiles.json",
      "accessed": "2026-10-31"
    },
    {
      "id": "src_profile_kidney_infection",
      "kind": "internal_profile",
      "title_fa": "شناسنامهٔ عفونت کلیه در مخزن",
      "publisher": "همیار جراحی — دادهٔ قالب",
      "ref": "themes/lax-theme-child/data/disease-profiles.json#kidney_infection",
      "url": "https://github.com/lakanzino/OR-site/blob/main/themes/lax-theme-child/data/disease-profiles.json",
      "accessed": "2026-10-31"
    },
    {
      "id": "src_profile_uti",
      "kind": "internal_profile",
      "title_fa": "شناسنامهٔ عفونت مجاری ادراری در مخزن",
      "publisher": "همیار جراحی — دادهٔ قالب",
      "ref": "themes/lax-theme-child/data/disease-profiles.json#urinary_tract",
      "url": "https://github.com/lakanzino/OR-site/blob/main/themes/lax-theme-child/data/disease-profiles.json",
      "accessed": "2026-10-31"
    },
    {
      "id": "src_profile_gastro",
      "kind": "internal_profile",
      "title_fa": "شناسنامهٔ التهاب معده و روده در مخزن",
      "publisher": "همیار جراحی — دادهٔ قالب",
      "ref": "themes/lax-theme-child/data/disease-profiles.json#gastroenteritis",
      "url": "https://github.com/lakanzino/OR-site/blob/main/themes/lax-theme-child/data/disease-profiles.json",
      "accessed": "2026-10-31"
    },
    {
      "id": "src_nhs_app",
      "kind": "clinical_guideline",
      "title_fa": "NHS — آپاندیسیت (نشانه‌ها و توصیهٔ مراجعهٔ فوری)",
      "publisher": "NHS",
      "url": "https://www.nhs.uk/conditions/appendicitis/",
      "accessed": "2026-10-31"
    },
    {
      "id": "src_niddk_stone",
      "kind": "clinical_guideline",
      "title_fa": "NIDDK — نشانه‌ها و علل سنگ کلیه",
      "publisher": "NIDDK (NIH)",
      "url": "https://www.niddk.nih.gov/health-information/urologic-diseases/kidney-stones/symptoms-causes",
      "accessed": "2026-10-31"
    },
    {
      "id": "src_nhs_uti",
      "kind": "clinical_guideline",
      "title_fa": "NHS — عفونت مجاری ادراری (UTI)",
      "publisher": "NHS",
      "url": "https://www.nhs.uk/conditions/urinary-tract-infections-utis/",
      "accessed": "2026-10-31"
    },
    {
      "id": "src_nhs_kidney_infection",
      "kind": "clinical_guideline",
      "title_fa": "NHS — عفونت کلیه",
      "publisher": "NHS",
      "url": "https://www.nhs.uk/conditions/kidney-infection/",
      "accessed": "2026-10-31"
    },
    {
      "id": "src_niddk_gastro",
      "kind": "clinical_guideline",
      "title_fa": "NIDDK — التهاب معده و روده (گاستروانتریت)",
      "publisher": "NIDDK (NIH)",
      "url": "https://www.niddk.nih.gov/health-information/digestive-diseases/gastroenteritis",
      "accessed": "2026-10-31"
    }
  ],
  "symptoms": [
    { "id": "s_pain_abdomen", "label_fa": "درد شکم", "synonyms": ["دل‌درد", "درد معده"], "category": "pain" },
    { "id": "s_pain_periumbilical_start", "label_fa": "شروع درد در اطراف ناف", "synonyms": [], "category": "pain" },
    { "id": "s_pain_migrates_rlq", "label_fa": "حرکت درد به پایین سمت راست شکم", "synonyms": [], "category": "pain" },
    { "id": "s_pain_rlq", "label_fa": "درد در پایین سمت راست شکم", "synonyms": [], "category": "pain" },
    { "id": "s_pain_worse_movement", "label_fa": "بدترشدن درد با حرکت، راه‌رفتن یا سرفه", "synonyms": [], "category": "pain" },
    { "id": "s_appetite_loss", "label_fa": "کم‌شدن اشتها", "synonyms": ["بی‌اشتهایی"], "category": "general" },
    { "id": "s_nausea", "label_fa": "تهوع", "synonyms": [], "category": "gi" },
    { "id": "s_vomiting", "label_fa": "استفراغ", "synonyms": [], "category": "gi" },
    { "id": "s_fever", "label_fa": "تب یا احساس تب", "synonyms": ["تب‌لرز"], "category": "general" },
    { "id": "s_chills", "label_fa": "لرز", "synonyms": [], "category": "general" },
    { "id": "s_constipation", "label_fa": "یبوست", "synonyms": [], "category": "gi" },
    { "id": "s_diarrhea", "label_fa": "اسهال", "synonyms": [], "category": "gi" },
    { "id": "s_bloating", "label_fa": "نفخ شکم", "synonyms": [], "category": "gi" },
    { "id": "s_no_gas_pass", "label_fa": "ناتوانی در دفع گاز", "synonyms": [], "category": "gi" },
    { "id": "s_flank_pain", "label_fa": "درد پهلو یا کمر", "synonyms": ["درد ناحیهٔ کلیه"], "category": "pain" },
    { "id": "s_radiate_groin", "label_fa": "انتشار درد به کشالهٔ ران یا پایین شکم", "synonyms": [], "category": "pain" },
    { "id": "s_colicky_pain", "label_fa": "درد موج‌وار (کم و زیاد می‌شود)", "synonyms": [], "category": "pain" },
    { "id": "s_dysuria", "label_fa": "سوزش یا درد هنگام ادرار", "synonyms": [], "category": "urinary" },
    { "id": "s_frequency", "label_fa": "تکرر ادرار", "synonyms": [], "category": "urinary" },
    { "id": "s_urgency", "label_fa": "فوریت ادراری", "synonyms": ["فشار ناگهانی برای ادرار"], "category": "urinary" },
    { "id": "s_hematuria", "label_fa": "خون در ادرار یا ادرار صورتی/قرمز/قهوه‌ای", "synonyms": [], "category": "urinary" },
    { "id": "s_cloudy_urine", "label_fa": "ادرار کدر یا بدبو", "synonyms": [], "category": "urinary" },
    { "id": "s_bladder_pressure", "label_fa": "درد یا فشار ناحیهٔ مثانه", "synonyms": [], "category": "urinary" },
    { "id": "s_abdominal_cramp", "label_fa": "درد یا گرفتگی شکم", "synonyms": ["کرامپ شکم"], "category": "gi" },
    { "id": "s_dehydration", "label_fa": "نشانه‌های کم‌آبی", "synonyms": ["خشکی دهان", "کاهش ادرار"], "category": "general" },
    { "id": "s_blood_stool", "label_fa": "خون در مدفوع", "synonyms": [], "category": "gi" }
  ],
  "questions": [
    {
      "id": "q_pain_present",
      "text_fa": "آیا در ناحیهٔ شکم، پهلو یا کمر دردی داری؟",
      "type": "boolean3",
      "options": [
        { "id": "yes", "label_fa": "بله" },
        { "id": "no", "label_fa": "نه، دردی ندارم" },
        { "id": "unknown", "label_fa": "مطمئن نیستم" }
      ],
      "source_refs": ["src_profile_app", "src_nhs_app"],
      "visibility": { "always": true },
      "ask_order": 10,
      "why_fa": "شروع مسیر از وجود یا نبود درد، تا نشانه‌های دیگر به کاربر تحمیل نشود."
    },
    {
      "id": "q_pain_location",
      "text_fa": "درد را بیشتر کجا حس می‌کنی؟",
      "type": "single",
      "options": [
        { "id": "periumbilical", "label_fa": "اطراف ناف" },
        { "id": "right_lower", "label_fa": "پایین سمت راست شکم" },
        { "id": "other_abdomen", "label_fa": "جای دیگری از شکم" },
        { "id": "flank_or_back", "label_fa": "پهلو یا کمر" },
        { "id": "multiple", "label_fa": "چند ناحیه" },
        { "id": "unknown", "label_fa": "نمی‌دانم" }
      ],
      "source_refs": ["src_profile_app", "src_nhs_app", "src_niddk_stone"],
      "visibility": { "any_of": [{ "question_id": "q_pain_present", "answers": ["yes", "unknown"] }] },
      "ask_order": 20,
      "why_fa": "محل درد یکی از سرنخ‌های مسیر است؛ هیچ محلی بیماری را قطعی نمی‌کند."
    },
    {
      "id": "q_pain_migrated_rlq",
      "text_fa": "آیا درد از اطراف ناف شروع شد و بعد به پایین سمت راست شکم رفت؟",
      "type": "boolean3",
      "options": [
        { "id": "yes", "label_fa": "بله" },
        { "id": "no", "label_fa": "نه" },
        { "id": "unknown", "label_fa": "نمی‌دانم" }
      ],
      "source_refs": ["src_profile_app", "src_nhs_app"],
      "visibility": { "any_of": [{ "question_id": "q_pain_present", "answers": ["yes", "unknown"] }] },
      "ask_order": 30,
      "why_fa": "الگوی حرکت درد در آپاندیسیت شایع است، اما همیشه دیده نمی‌شود و الگوی غیرمعمول هم ممکن است."
    },
    {
      "id": "q_pain_onset",
      "text_fa": "درد چه زمانی شروع شد؟",
      "type": "single",
      "options": [
        { "id": "today", "label_fa": "امروز" },
        { "id": "two_three_days", "label_fa": "یک تا سه روز پیش" },
        { "id": "longer", "label_fa": "بیشتر از سه روز پیش" },
        { "id": "unknown", "label_fa": "نمی‌دانم" }
      ],
      "source_refs": ["src_nhs_app"],
      "visibility": { "any_of": [{ "question_id": "q_pain_present", "answers": ["yes", "unknown"] }] },
      "ask_order": 40,
      "why_fa": "مدت زمان برای توضیح روند و ارجاع لازم است، نه برای انتخاب بیماری."
    },
    {
      "id": "q_pain_course",
      "text_fa": "درد نسبت به شروعش چه روندی داشته است؟",
      "type": "single",
      "options": [
        { "id": "worse", "label_fa": "بدتر شده" },
        { "id": "stable", "label_fa": "تقریباً ثابت مانده" },
        { "id": "better", "label_fa": "کمتر شده" },
        { "id": "intermittent", "label_fa": "می‌آید و می‌رود" },